Case Number,Type,Status,Project Name,Applied Date,Expiration Date,Completion Date,Module Name,Address,Main Parcel,Description
"REZ2018-00012","Rezoning - Non-Residential","Approved","Town of Occoquan Park - Oaks III","12/14/2017","","","Plan","1940 OLD BRIDGE RD WOODBRIDGE VA 22192","8393-33-7107","Town of Occoquan Park - Oaks III -  Request to rezone 17.65 acres from O(L), Office-Low and SR-1, Semi-Rural Residential to A-1, Agricultural for intended use as a park.  This is being concurrently processed with a request to amend the Comprehensive Plan long-range land use designation for 17.65 acres from O, Office and SRL, Suburban Residential Low, to P&OS, Parks and Open Space. The subject property is located north of the intersection of Old Bridge Road and Tanyard Hill Road.  The site is addressed as 1940 Old Bridge Road and 1894 Tanyard Hill Road.  The site is identified on County maps as GPINs 8393-33-7107 and 8393-42-0995, and is zoned A-1, Agricultural, O(L), Office Low, and SR-1, Semi-Rural Residential.  The site is currently designated O, Office and SRL, Semi-Rural Residential, in the Comprehensive Plan and is partially located within the Old Bridge Highway Corridor Overlay District.  Occoquan Magisterial District."
"REZ2018-00011","Rezoning - Proffer Amendment","Approved","Dominion Valley Country Club Proffer Amendment","11/27/2017","","","Plan","5600 JAMES MADISON HWY HAYMARKET VA 20169","7298-49-4583","Dominion Valley Country Club Proffer Amendment -  This is a request to amend Rezoning #PLN2005-00197, Dominion Valley Country Club, to modify approved land bays and allow an additional 47 units from what was previously approved. The application includes a 3.32-acre parcel located north of the intersection of Regency Club Drive and Dominion Valley Drive, and a 5.7-acre parcel located on the north side of Dominion Valley Drive, immediately west of its intersection with Waverly Farm Drive. The site is identified on County maps as GPINs 7298-49-4583 and 7299-71-0911; is zoned RPC, Residential Planned Community; and is designated RPC, Residential Planned Community in the Comprehensive Plan. Gainesville Magisterial District."
"REZ2018-00010","Rezoning - Minor Modification","Approved","CARTER'S MILL (FORMERLY KNOWN AS MIDWOOD)","11/16/2017","","","Plan","15605 JOHN MARSHALL HWY HAYMARKET VA 20169","7298-32-0722","Minor Modification of Rezoning #PLN2014-00190 proffer #12 to allow for a shift of the lots to place seven lots situated parallel to John Marshall Highway/Route 55."
"REZ2018-00007","Rezoning - Residential","Suspended (On-Hold)","Gatherings at Occoquan Ridge","11/13/2017","","","Plan","12400 CLIPPER DR WOODBRIDGE VA 22192","8393-24-4372","Gatherings at Occoquan Ridge -  This is a request to rezone 2.08 acres from A-1, Agricultural, to RPC, Residential Planned Community, in order to construct 29 age restricted condominiums. The property is addressed: 12400 Clipper Drive, Woodbridge, VA, is identified on County maps as GPIN: 8393-24-4372, and is designated RPC, Residential Planned Community, in the Comprehensive Plan. Occoquan Magisterial District."
"REZ2018-00016","Rezoning - Residential","Approved","Bradys Hill","11/09/2017","","","Plan","4000 BRADYS HILL RD TRIANGLE VA 22172","8188-76-3837","Bradys Hill Rezoning; this is a request to rezone 3.81 acres from B-2, Neighborhood Business, R-4, Suburban Residential, and V, Village, to PMR, Planned Mixed Residential, and with associated modifications, to allow a residential development consisting of up to 59 multi-family units.  The subject property is generally located northwest and southwest of the intersection of Bradys Hill Road and Old Triangle Road, and is identified on County maps as the following GPINs:  8188-76-2504, 8188-76-3418, 8188-76-3837, 8188-76-5334, 8188-76-5131, 8188-76-4529, 8188-76-4823, 8188-76-4619, 8188-76-4612, 8188-76-4127, 8188-76-4304, 8188-75-4299, 8188-75-3997, 8188-75-3196, 8188-75-3099, 8188-76-4940, 8188-75-4093, 8188-75-3789, 8188-75-3164, 8188-75-3568, 8188-75-3479, 8188-76-4101, 8188-76-4302, 8188-76-3109, 8188-76-2810, 8188-76-3307 and 8188-76-3605.  The site is designated URM, Urban Residential Medium, and VMU, Village Mixed Use, in the Comprehensive Plan; is located within the Triangle Study Area and Potomac Communities Revitalization Plan special planning areas; and partially within the Triangle Center of Community.  Potomac Magisterial District"
"REZ2018-00006","Rezoning - Non-Residential","Approved","Residency Road Rezoning","11/08/2017","","","Plan","10000 PENNSYLVANIA AVE MANASSAS VA 20110","7695-03-8930","Residency Road Rezoning; To rezone 13.61 acres from B-1, General Business, M-1, Heavy Industrial, and M-2, Light Industrial, to PBD, Planned Business District, with associated development and use waivers/modifications, to develop indoor and outdoor commercial recreation facilities, among other potential uses.  The subject property is located approximately 200 feet southeast of the intersection of Residency Road and Nokesville Road (Route 28), west of Pennsylvania Avenue, and immediately northwest of the intersection of Carolina Drive and Pennsylvania Avenue.  The site is identified on County maps as GPINs 7695-03-8930, 7695-03-9957 (portion), and 7695-12-1562; and is currently addressed as 10103 Residency Road, and 10000 and 10100 Pennsylvania Avenue, respectively.  The site is currently designated REC, Regional Employment Center, in the Comprehensive Plan; is partially located within the Nokesville Road (Route 28) Highway Corridor Overlay District; and within the Airport Safety Overlay District.  Brentsville Magisterial District"
"REZ2018-00008","Rezoning - Mixed Use","Approved","Gainesville Crossing","11/02/2017","","","Plan","12551 LEE HWY GAINESVILLE VA 20155","7497-67-8141","Gainesville Crossing -  To rezone 152.7 acres from A-1, Agricultural, to PBD, Planned Business District, to allow a mix of commercial uses, and a modification to allow data center, electric substation, and other uses in the PBD district, not to exceed 4,670,835 sq. ft. in total. The application also includes waivers and modifications. The site is located on the south side of Lee Hwy (Route 29) between its intersections with Heathcote Blvd/ I-66 Exit 43B off ramp and Pageland Ln, and is on the north side of I-66. The site is identified on County maps as GPINs 7497-67-8141 and 7497-26-9609 (part); is located within the Airport Safety and Route 29 Highway Corridor Overlay Districts; and is designated REC, Regional Employment Center, in the Comprehensive Plan. The site is also partially within the 1-66/Route 29 Sector Plan"
"DPA2018-00008","Development Policy Amendment - Worksession","Review Completed","DORT Recommendations","09/27/2017","","","Plan","","","ZTA: Buffers - A Zoning Text Amendment to amend Secs. 32-250.31, 32-250.32, 32 404.04, and 32-800.11 pertaining to buffer requirements. The amendment provides flexibility for compliance with buffer standards for non-residential lots of three acres or less, permits waivers and modifications of buffer requirements at the time of rezoning or Special Use Permit approval, and permits flexibility for compliance with buffer standards in planned development districts. Countywide."
"REZ2018-00005","Rezoning - Non-Residential","Approved","English Gardens","09/08/2017","","","Plan","14195 DUMFRIES RD MANASSAS VA 20112","7892-51-2126","English Gardens - A request to rezone +/- 11.9 acres from A-1, Agricultural, to O(F), Office/Flex, and M-T, Industrial/Transportation."
"REZ2018-00004","Rezoning - Non-Residential","Approved","8534 Wellington Road Rezoning","08/17/2017","","","Plan","8534 WELLINGTON RD MANASSAS VA 20109","7696-13-9709","8534 Wellington Road - To rezone 1.77 acres from A-1, Agricultural, to O(M), Office Mid-Rise, (and to request associated modifications and waivers, including an FAR increase) to develop as a corporate office headquarters for a mechanical services business.  The site is located on the south side of Wellington Road; 1,380 feet east of the intersection of Wellington Road and Vulcan Lane; and 1,730 feet west of the intersection of Wellington Road and Freedom Center Boulevard.   The subject property is identified on County maps as GPIN 7696-13-9709 and is currently addressed as 8534 Wellington Road.  The site is currently designated REC, Regional Employment Center, in the Comprehensive Plan, and is located within the Innovation Sector Plan special planning area.  The site is also located within the Technology Overlay District (TeOD); the Higher Education Office/Research & Development (HO) subdistrict of the TeOD; the Data Center Opportunity Overlay District; and the Airport Safety Overlay District.  Brentsville Magisterial District."
"ZNA2018-00993","Zoning Approval - Building Permit Zoning Approval","Approved","","08/10/2017","","","Plan","4628 EASTERLIN WAY WOODBRIDGE VA 22192","8193-24-2742","BPA - 8' X 12' OPEN DECK WITH NO STAIRS - NO RPA -  MUST COMPLY WITH ALL CONDITIONS OF REZONING 2006-00898 -SEE ATTACHED HOUSE LOCATION SURVEY PLAT"
"REZ2018-00002","Rezoning - Proffer Amendment","Approved","Brickyard","08/01/2017","","","Plan","10006 GODWIN DR MANASSAS VA 20110","7695-53-7817","Brickyard - This is a request to amend Rezoning #PLN2010-00141, to modify an existing berm and landscaped areas, and incorporate additional technical revisions. The 156-acre site is addressed as 10006 and 10000 Godwin Drive; and is located on the south side of Godwin Drive, approx. 850 feet east of its intersection with Gateway Blvd. The site is identified on County maps as GPINs 7695-62-0648 and 7695-63-8841; is zoned M-1, Heavy Industrial; and is designated EI, Industrial Employment, ER, Environmental Resource, and SRL, Suburban Residential Low, in the Comprehensive Plan. The property also falls within the Manassas Airport Safety, the Flood Hazard, and the Data Center Opportunity Overlay Districts. Coles Magisterial District."
"REZ2018-00003","Rezoning - Proffer Amendment","Approved","Ashland Square Parcel B ","07/31/2017","","","Plan","15835 SPRIGGS RD WOODBRIDGE VA 22193","8090-58-8302","Ashland Square Parcel B - To amend the proffers associated with REZ #97-0034, applicable to Ashland Square Parcel B, to propose site access improvements, landscape buffer waivers and modifications, and to amend use limitations and various development parameters.  The subject property (Parcel B) is currently located in the northeast quadrant of the intersection of Dumfries Road and Spriggs Road; is currently addressed as 15835 Spriggs Road; and is identified on County maps as GPIN 8090-58-8302.   The site is zoned B-1, General Business; is designated NC, Neighborhood Commercial, in the Comprehensive Plan; and is located within both the Dumfries Road (Route 234) and Spriggs Road Highway Corridor Overlay Districts.  Potomac Magisterial District"
"REZ2018-00001","Rezoning - Proffer Amendment","Approved","Ashwood","07/11/2017","","","Plan","10400 HARRY J PARRISH BLVD MANASSAS VA 20110","7695-50-2691","Ashwood Addition - This is a request to amend the proffers of #REZ2017-00012 to modify a floodplain, open space, and landscaping, add additional land area, and incorporate additional technical revisions; and rezone 1.09 acres from A-1, Agricultural, to M-2, Light Industrial. The 98.97-acre site is located on the south side of the Prince William Parkway (Route 234), approximately 3,000 feet south of its intersection with Nokesville Road. The site is identified on County maps as GPIN 7695-50-2691 and includes VDOT right-of-way; is zoned M-2, Light Industrial, and A-1, Agricultural; and is designated FEC, Flexible Use Employment Center, and ER, Environmental Resource, in the Comprehensive Plan. The property also falls within the Manassas Airport Safety, the Flood Hazard, and the Data Center Opportunity Overlay Districts. Coles Magisterial District.  Also Minor Mod MOD2021-00017"
"REZ2017-00027","Rezoning - Proffer Amendment","Approved","","06/26/2017","","","Plan","13285 MINNIEVILLE RD WOODBRIDGE VA 22192","8292-65-4454","Kaiser South - This is a request to amend the proffers of #PLN2009-00339 to allow a maximum of 335,000 sq. ft. of office and employment uses and structured parking; and allow waivers and modifications."
"REZ2017-00025","Rezoning - Proffer Amendment","Approved","The Village at Heathcote","04/28/2017","","","Plan","15050 HEATHCOTE BLVD HAYMARKET VA 20169","7298-83-6287","The Village at Heathcote Medical Office -  To amend the proffers associated with REZ #PLN2004-00298 to allow a medical office building with a minimal size of 35,000 square feet on Land Bay 1 within The Village at Heathcote, which is a planned development to contain a mix of employment and service commercial uses.  The 15-acre property subject to this proffer amendment is located on the northern and southern sides of Heathcote Boulevard, and 325 feet west of the intersection with James Madison Highway (Route 15); is addressed as 15050 Heathcote Boulevard and 6427 James Madison Highway; and is identified on County maps as GPINs 7298-83-6287 and 7298-83-6418 .  The site is zoned PBD, Planned Business District; is designated REC, Regional Employment Center, and ER, Environmental Resource, in the Comprehensive Plan; and is partially located within the James Madison Highway Corridor Overlay District and the Airport Safety Overlay District.  Gainesville Magisterial District."
"REZ2017-00026","Rezoning - Proffer Amendment","Approved","Smith Pond","04/17/2017","","","Plan","9413 LOMAX FOREST DR MANASSAS VA 20112","7794-48-0417","REZ2017-00026, Smith Pond; Proffer Amendment Request to amend the existing proffers pursuant to #REZ2006-00168 to remove a proposed walking trail. The property is located at 9413 Lomax Forest Drive, approximately .322 miles north of the Lucasville Rd. and Godwin Dr. intersection. The property is identified on County maps as GPIN: 7794-48-0417. The site is zoned R-4, Suburban Residential, and is designated SRL, Suburban Residential Low, in the Comprehensive Plan. The property is located in the Airport Safety Overlay District. Coles Magisterial District."
"REZ2017-00023","Rezoning - Mixed Use","Approved","Aura Development","04/12/2017","","","Plan","8227 LINTON HALL RD BRISTOW VA 20136","7496-37-4872","Aura Development -  This is a request to rezone 261.11 acres from A-1, Agricultural, to M-2, Light Industrial, to allow by-right uses, including data center development, and allow an increased building height of up to 80 feet."
"REZ2017-00022","Rezoning - Proffer Amendment","Approved","Cheshire Station","04/04/2017","","","Plan","14119 MINNIEVILLE RD WOODBRIDGE VA 22193","8192-50-8821","Cheshire Station - Starbucks; Proffer Amendment, (PRA), request to amend the existing proffers pursuant to #REZ1999-0020 to allow a Starbucks with drive-up window service at Cheshire Station shopping center. The subject site is located at the southeast quadrant of the intersection of Minnieville Rd and Dale Blvd and is identified on County maps as GPIN 8192-50-8821. The Subject site is zoned B-1, General Business and is designated NC, Neighborhood Commercial, in the Comprehensive Plan. The Property is located in the Dale Boulevard HCOD, and Minnieville RD HCOD, Highway Corridor Overlay District. Neabsco Magisterial District."
"ZNR2017-00190","Zoning Review - Verification","Closed","","04/03/2017","","","Plan","11910 BALLS FORD RD MANASSAS VA 20109","7597-34-9104","ZONING VERIFICATION FOR DESIGNATION, SWM FACILITY PERMITTED, VIOLATIONS, TAXING DISTRICT, REZONING/SUP/VAR, LAWFUL LOT STATUS, SITE PLAN APPROVAL"
"ZNR2017-00189","Zoning Review - Verification","Closed","","04/03/2017","","","Plan","11900 BALLS FORD RD MANASSAS VA 20109","7597-34-9837","ZONING VERIFICATION FOR DESIGNATION, SWM FACILITY PERMITTED, VIOLATIONS, TAXING DISTRICT, REZONING/SUP/VAR, LAWFUL LOT STATUS, SITE PLAN APPROVAL"
"ZNR2017-00187","Zoning Review - Verification","Closed","","04/03/2017","","","Plan","7300 GROVETON RD MANASSAS VA 20109","7597-35-7115","ZONING VERIFICATION FOR DESIGNATION, SWM FACILITY PERMITTED, VIOLATIONS, TAXING DISTRICT, REZONING/SUP/VAR, LAWFUL LOT STATUS, SITE PLAN APPROVAL"
"ZNR2017-00188","Zoning Review - Verification","Closed","","03/22/2017","","","Plan","11920 BALLS FORD RD MANASSAS VA 20109","7597-33-9464","ZONING VERIFICATION FOR DESIGNATION, SWM FACILITY PERMITTED, VIOLATIONS, TAXING DISTRICT, REZONING/SUP/VAR, LAWFUL LOT STATUS, SITE PLAN APPROVAL"
"REZ2017-00021","Rezoning - Proffer Amendment","Approved","Starbucks - Worth Avenue","03/21/2017","","","Plan","13000 WORTH AVE WOODBRIDGE VA 22192","8292-62-9427","Exxon/Smoketown Station Sign Modification; Proffer Amendment, (PRA), request to amend the existing proffers pursuant to #REZ1994-0009 allowing additional signage on lot 6. The subject site is located at the intersection of Prince William Parkway and Worth Avenue and is identified on County maps as GPIN 8292-62-9427. The subject site is zoned PBD, Planned Business District, and is designated RCC, Regional Commercial Center, in the Comprehensive Plan. The property is located in the Prince William Parkway HCOD, Highway Corridor Overlay District. Occoquan Magisterial District."
"CPA2017-00001","Comp Plan Amendment (Concurrent with Rezoning)","Closed","Williamson Village","03/21/2017","","","Plan","10365 LOMOND DR MANASSAS VA 20109","7696-59-5541","Williamson Village - To amend the Comprehensive Plan land use designation for 14.27 acres from GC, General Commercial to SRH, Suburban Residential High so parcel can be rezoned to a higher density residential community.  Applicant will submit concurrent rezoning application.  Brentsville Magisterial District."
"CPA2017-00002","Comp Plan Amendment (Concurrent with Rezoning)","Suspended (On-Hold)","Zetlin Property","03/21/2017","","","Plan","7721 OLD CAROLINA RD GAINESVILLE VA 20155","7297-51-5436","Zetlin Property - To amend the Comprehensive Plan land use designation for 17.22 acres from SRL, Suburban Residential Low to CEC, Commercial Employment Center, to provide mixed-use project.  Applicant will submit concurrent rezoning application.  Brentsville Magisterial District."
"REZ2017-00020","Rezoning - Proffer Amendment","Approved","James Madison Marketplace","03/07/2017","","","Plan","15410 JOHN MARSHALL HWY HAYMARKET VA 20169","7298-53-6088","James Madison Marketplace - This is a request to change the proffered layout, increase the approved commercial gross floor area, and include additional revisions for a portion of Rezoning #PLN2008-00668. The 19.83-acre site is located on the north side of John Marshall Hwy (Route 55), approximately 1,650 feet west of Route 15. The site is identified on County maps as GPIN 7298-53-6088 (part); is zoned PBD, Planned Business District; and is designated REC, Regional Employment Center, in the Comprehensive Plan. Gainesville Magisterial District."
"CPA2017-00003","Comp Plan Amendment (Concurrent with Rezoning)","Withdrawn","Broad Run Center","03/06/2017","","","Plan","10203 GOLF ACADEMY DR BRISTOW VA 20136","7595-72-5213","Broad Run Center - To amend the Comprehensive Plan land use designation for. 33.60 acres from Office (O) and Environmental Resource (ER) to General Commercial (GC).  Applicant will file a rezoning application for the Property to B-1, General Business District.    Brentsville Magisterial District."
"SDR2017-00044","Subdivision Plan - Revision","Approved","","02/21/2017","","","Plan","1501 CHERRY HILL RD DUMFRIES VA 22026","8388-19-4008","POTOMAC SHORES LB 4 SEC 2 - REVISION TO SUBDIVISION PLAN FOR DUPLEX UNITS &TOWNHOMES"
"REZ2017-00024","Rezoning - Mixed Use","Approved","Liberia Avenue","02/13/2017","","","Plan","9845 LIBERIA AVE MANASSAS VA 20110","7895-24-5376","Liberia Avenue - This is a request to rezone the subject 16.21-acre site from O(M), Office Mid-Rise, to B-1, General Business. The property is located at 9845 Liberia Avenue, at the northeast corner of the intersection of Prince William Parkway and Liberia Avenue. The site is identified on County maps as GPIN 7895-24-5376; is zoned O(M), Office Mid-Rise; is located within the Prince William Parkway Highway Corridor Overlay District; and is designated CEC, Community Employment Center, in the Comprehensive Plan. Coles Magisterial District."
"REZ2017-00019","Rezoning - Proffer Amendment","Approved","Madison Square","01/31/2017","","","Plan","","7297-20-5229","Madison Square - This is a request to amend Proffer Amendment PLN2008-00325 to allow B-1 uses in Land Bays B and C, modify development phasing and triggers, and incorporate additional revisions for a mixed-use project with up to 170,000 square feet of office/commercial/retail development and 25 single-family detached units. The 25-acre site is located on the north side of Route 29, approximately 1,300 feet east of Route 15. The site is identified on County maps as GPIN 7297-20-5229; is zoned PMD, Planned Mixed Use District; and is designated CEC, Community Employment Center, and ER, Environmental Resource, in the Comprehensive Plan and is a part of the 1-66/Route 29 Sector Plan. Brentsville Magisterial District."
"ZNA2017-03576","Zoning Approval - Sign","Approved","","01/19/2017","","","Plan","2701 NEABSCO COMMON PL Unit: 142 WOODBRIDGE VA 22191","8291-82-4467.01","VIET FORTUNE FACADE SIGN - 20.84 SQFT - ALLOWABLE PER REZONING PROFFER AMENDMENT PLN2009-00554"
"SDR2017-00037","Subdivision Plan - Revision","Approved","","01/17/2017","","","Plan","2175 CHERRY HILL RD RD DUMFRIES VA 22026","8289-91-8437","POTOMAC SHORES LANDBAY 4 SEC 1 - REVISION PLAN FOR RESUBDIVISION"
"REZ2017-00018","Rezoning - Proffer Amendment","Approved","University Village Proffer Amendment","01/17/2017","","","Plan","","7596-51-8465","University Village Proffer Amendment - This is a request to amend Rezoning PLN2003-00250, University Village, to modify proffered recreational facilities and allow a resident activity center in lieu of an approved sport court. The 19.08-acre site is located approximately 1,000 feet north of the intersection of Patriot Hill Drive and University Boulevard. The site is identified on County maps as GPIN 7596-51-8465 (part); is zoned PMD, Planned Mixed Use District; and is designated REC, Regional Employment Center, and ER, Environmental Resource, in the Comprehensive Plan. The property also falls within the Airport Safety Overlay and the Data Center Opportunity Overlay Districts. Brentsville Magisterial District."
"REZ2017-00017","Rezoning - Non-Residential","Approved","ALTERNATIVE PATHS TRAINING SCHOOL REZ","01/17/2017","","","Plan","8421 BARRETT DR MANASSAS VA 20109","7696-86-8147","Alternative Paths Training School; A request to rezone from A-1, Agricultural, to B-1, General Business, in order to consolidate addresses 8421 & 8509 Barrett Drive, Manassas, VA, and allow the expansion of the existing private school use located at 8509 Barrett Drive, Manassas, VA with the subject parcel. The site is zoned A-1, Agricultural, and is designated GC, General Commercial, in the Comprehensive Plan. The property is identified on County maps as GPIN: 7696-86-8147 and is addressed: 8421 Barret Drive, Manassas, VA. Brentsville Magisterial District."
"REZ2017-00016","Rezoning - Proffer Amendment","Approved","USTA at Innovation (formerly SA Group)","12/20/2016","","","Plan","8995 ELLSWORTH RD MANASSAS VA 20110","7696-31-8611","USTA at Innovation (formerly SA Group Proffer Amendment) - This is a request to amend the proffers of #PLN2008-00154 to: modify permitted uses; include waivers; eliminate building height and floor area ratio minimum requirements; reduce the approved gross floor area to a maximum of 307,000 square feet; and incorporate additional revisions."
"REZ2017-00015","Rezoning - Proffer Amendment","Approved","Sudley Manor House (Parcel H) Proffer Amendment","12/12/2016","","","Plan","7750 GARNER DR MANASSAS VA 20109","7697-51-2340","Sudley Manor House (Parcel H) Proffer Amendment - To amend the proffers associated with REZ1997-0029 to increase the maximum number of residential units from 72 to 74 in an assisted living facility, which is existing and currently operating.  There will be no proposed changes to the site layout or exterior of the building to accommodate the two additional units.  The subject property is currently located at the southwestern intersection of Sudley Manor Drive and Garner Drive; is addressed as 7750 Garner Drive; and is identified on County maps as GPIN 7697-51-2340.    The site is zoned RPC, Residential Planned Community, (Commercial / Medium High Density Residential  Assisted Living) as part of the Sudley planned community, and is designated RPC in the Comprehensive Plan.  Gainesville Magisterial District"
"REZ2017-00014","Rezoning - Proffer Amendment","Approved","Neabsco Common","12/08/2016","","","Plan","2670 NEABSCO COMMON PL WOODBRIDGE VA 22191","8291-82-5288.00","Neabsco Commons - Proffer Amendment and Rezoning #REZ2017-00014, is a request to amend the proffers of #PLN2009-00554 on the subject 20.7-acre site, and rezone 3.6 acres of the site from O(H), Office High-Rise, to PMR, Planned Mixed Residential, to allow up to 64 multifamily (two-over-two) units. The property is located on the west side of Neabsco Mills Road, south of its intersection with Smoke Court. The site is zoned O(H), Office High-Rise, and is designated O, Office, in the Comprehensive Plan. It is within the boundary of the Neabsco Mills study area in the Potomac Communities Revitalization Plan; and is also located within the Neabsco Mills Road Highway Corridor Overlay District (HCOD).  This site is located within the Dale City Small Area Plan.
Neabsco Magisterial District"
