Case Number,Type,Status,Project Name,Applied Date,Expiration Date,Completion Date,Module Name,Address,Main Parcel,Description
"SUP2021-00030","Special Use - Special Use Permit","Deferred","Compton Property","05/24/2021","","","Plan","8750 RIXLEW LN MANASSAS VA 20109","7696-56-8064","Compton Property Special Use Permit - Request to allow for the data center use and the electrical substation outside the data center overlay district, subject to the approval of the rezoning application. As part of the request the applicant is seeking a modification to the building height to permit a max building height of 75 feet. The subject property is located approximately 2/3-mile northwest of the intersection of Godwin Dr. and Sudley Rd.; and is identified on County maps as GPINs 7696-56-8064, 7696-56-3095 and 7696-47-4559.  The site is designated GC, General Commercial and SRM, Suburban Residential Medium, in the Comprehensive Plan.  There is also a proposed Comprehensive Plan Amendment to change the designation to FEC, Flexible Employment Center which is being reviewed under CPA2021-00005; Brentsville Magisterial District."
"REZ2021-00019","Rezoning - Non-Residential","Suspended (On-Hold)","Compton Property","05/24/2021","","","Plan","8750 RIXLEW LN MANASSAS VA 20109","7696-56-8064","Compton Property Rezoning - This is a request to rezone 77.014 acres from A-1, Agricultural to PBD, Planned Business District, and to rezone 0.902 acres from B-1 General Business to PBD, Planned Business District, for the purpose of developing a data center and an electrical substation campus.  There is a concurrent SUP request to allow for the data center use and the electrical substation outside the data center overlay district, subject to the approval of the rezoning application. As part of the request the applicant is seeking a modification to the building height to permit a max building height of 75 feet. The subject property is located approximately 2/3-mile northwest of the intersection of Godwin Dr. and Sudley Rd.; and is identified on County maps as GPINs 7696-56-8064, 7696-56-3095 and 7696-47-4559.  The site is designated GC, General Commercial and SRM, Suburban Residential Medium, in the Comprehensive Plan.  There is also a proposed Comprehensive Plan Amendment to change the designation to FEC, Flexible Employment Center which is being reviewed under CPA2021-00005; Brentsville Magisterial District."
"REZ2021-00020","Rezoning - Residential","Approved","John Marshall","05/21/2021","","","Plan","14514 JOHN MARSHALL HWY GAINESVILLE VA 20155","7397-28-3631","John Marshall Village Addition - This is a request to rezone the subject area from A-1, Agricultural to V, Village, to allow for the development of 18 two-over-two multi-family residential units. It is concurrently being processed with a Special Use Permit to allow multi-family dwellings on lots in excess of 1 acre. The subject area is located at the approximately 325 ft. east of the intersection of Route 55 and Piedmont Center Place. The parcel is identified on County maps as GPIN 7397-28-3631 and is addressed 14514 John Marshall Highway, and is designated VMU, Village Mixed Use, in the Comprehensive Plan and located in the I-66/Route 29 Sector Plan. Gainesville Magisterial District"
"CPA2021-00004","Comp Plan Amendment (without Rezoning)","Approved","PW Digital Gateway - Expanded Study Area","05/19/2021","","","Plan","6385 PAGELAND LN GAINESVILLE VA 20155","7498-83-1869","PW Digital Gateway - A Comprehensive Plan Amendment to to change the Long Range Land Use from AE, Agricultural or Estate and ER, Environmental Resource to Technology / Flex (T/F) with a T-3 Transect create a Digital Corridor and include related impacts on supporting infrastructure and consider alternative comparable land use designation options that meet the needs of the Applicant and the priorities of the Prince WIlliam Board of County Supervisors."
"MOD2021-00015","Rezoning Minor Modification","Approved","","05/19/2021","","","Plan","1880 OPITZ BLVD WOODBRIDGE VA 22191","8391-36-6375","Koons Opitz Property; minor modification to amend FAR increase under PLN2009-00105"
"MOD2021-00012","Rezoning Minor Modification","Approved","","05/10/2021","","","Plan","2055 SILVER SYCAMORE LN DUMFRIES VA 22026","8389-31-4208","Potomac Shores - Minor Modification of PLN2012-00420, Potomac Shores, to amend the design guidelines, and reduce the minimum garage setback from 36 feet to 26 feet within Land Bay 5, Section 1, in Potomac Shores."
"REZ2021-00018","Rezoning - Non-Residential","Approved","Hudson Limited Partnership","05/03/2021","","","Plan","8819 WELLINGTON RD MANASSAS VA 20109","7696-42-2354","Hudson Limited Partnership - To rezone 8.5104 acres from A-1, Agricultural and M-2, Light Industrial, to M-2, Light Industrial with associated waivers and modifications.  The subject property is located along the north side of Wellington Rd., at the intersection of Freedom Center Blvd. and Wellington Rd., and is identified on County maps as GPINs 7696-32-8070 and 7696-42-2354.  The site is designated Technology/Flex as part of the Innovation Small Area Plan in the Comprehensive Plan. The property is located within the Data Center Opportunity Overlay, Technology Overlay and the Airport Safety Overlay Districts.  Brentsville Magisterial District"
"REZ2021-00017","Rezoning - Proffer Amendment","Approved","Potomac Shores","04/28/2021","","","Plan","1900 POTOMAC SHORES PKWY DUMFRIES VA 22026","8289-98-6732","Potomac Shores - This is a request to amend nonresidential phasing in Proffer #5b of Rezoning #PLN2012-00420 as amended by PRA #PLN2014-00399. The subject 770-acres site is located on the eastern end of the Cherry Hill Peninsula adjacent to the Potomac River, on the east and west sides of Potomac Shores Pkwy. The site is zoned PMR, Planned Mixed Residential, and PMD, Planned Mixed-Use District; is designated as CEC, Community Employment Center, REC, Regional Employment Center, SRH, Suburban Residential High, SRM, Suburban Residential Medium, SRL, Suburban Residential Low, SRR, Semi-Rural Residential, UMU, Urban Mixed Use, EI, Industrial Employment and ER, Environmental Resources, in the Comprehensive Plan; and is located within the Potomac Communities Revitalization Plan.  Woodbridge and Potomac Magisterial District."
"MOD2021-00011","Rezoning Minor Modification","Voided","","04/09/2021","","","Plan","12615 FOG LIGHT WAY BRISTOW VA 20136","7496-65-8860","Devlin Road Rezoning Minor Modification - Minor Modification of street tree locations and right-of-way widths"
"WAI2021-00117","Waiver - DCSM Sec 600","Approved","Yola Lane Corrective Rezoning","04/01/2021","","","Plan","7281 YOLA LN MANASSAS VA 20111","7895-94-9139","WAIVER FOR 7278 & 7281 YOLA LANE CORRECTIVE REZONING - FOR PIPESTEM DRIVEWAYS"
"REZ2021-00015","Rezoning - Non-Residential","Approved","Contractors Court","04/01/2021","","","Plan","9515 CONTRACTORS CT Unit: 100 MANASSAS VA 20109","7595-56-7123","Contractors Court - To rezone 6.2139 acres from M-1, Heavy Industrial, to M/T, Industrial/Transportation.  The subject property is located 1,500 feet southeast of the intersection/cul-de-sac of Industrial Rd., and Contractors Ct.; it is addressed as 9515 Contractors Ct., and is identified on County maps as GPIN 7595-56-7123.  The site is zoned M-1, Heavy Industrial, and it is designated EI, Industrial Employment, and ER, Environmental Resource in the Comprehensive Plan; and is located within the Data Center Opportunity Overlay District, and Airport Safety Overlay District. Brentsville Magisterial District"
"MOD2021-00009","Rezoning Minor Modification","Approved","","03/24/2021","","","Plan","7286 WELLINGTON RD MANASSAS VA 20109","7596-26-7193","Becknell Manassas Minor Modification - Minor Modification to REZ1985-0057 to modify proffers 2, 6 and 7"
"REZ2021-00016","Rezoning - Non-Residential","Approved","Broad Run Industrial Park Lot 1A","03/23/2021","","","Plan","11144 INDUSTRIAL RD MANASSAS VA 20109","7595-69-2101","Broad Run Industrial Park Lot 1A - To rezone 2.43 acres from M-2, Light Industrial, to M/T, Industrial/Transportation.  The subject property is located on the north side of Industrial Rd., 2,000 ft. west of its intersection with Hornbaker Rd.  The site is identified on County maps as GPIN 7595-69-2101 The site is designated EI, Industrial Employment, in the Comprehensive Plan; and is located within the Data Center Opportunity Overlay District and the Airport Safety Overlay District.  Brentsville Magisterial District"
"REZ2021-00013","Rezoning - Proffer Amendment","Withdrawn","Manassas Mall Proffer Amendment","02/26/2021","","","Plan","8300 SUDLEY RD MANASSAS VA 20109","7696-65-8558","Manassas Mall PRA - To amend the proffers associated with #REZ1995-00035 to allow motor vehicle sales.  This is being concurrently processed with a special use permit to allow a recreational motor vehicle sales, rental or lease, repair, motorcycle sales, motorcycle rental or lease, repair, and instructional school, with a signage modification."
"REZ2021-00012","Rezoning - Residential","Approved","Park Landing","02/19/2021","","","Plan","3301 NOBLE POND WAY WOODBRIDGE VA 22193","8292-21-7346","Park Landing - This is a request to rezone 9.76 acres from PBD, Planned Business District, to PMR, Planned Mixed Residential, to allow for the development of up to 250 age restricted multi-family dwelling units with a building height modification, and associated waivers and modifications.  The subject property is located on a vacant pad site at the southeastern intersection of Golansky Boulevard and Noble Pond Way.  The site is currently addressed as 3301 Noble Pond Way and is identified on County maps as GPIN 8292-21-7346.  The site is designated HDN, High Density Neighborhood; and with small peripheral eastern portions being designated as POSP, Parks and Open Space Passive, and NMU, Neighborhood Mixed Use, in the Comprehensive Plan; is located within the Parkway Node of the Dale City Small Area Plan; and is also partially located in the Prince William Parkway Highway Corridor Overlay District.  Occoquan Magisterial District"
"REZ2021-00011","Rezoning - Residential","Approved","Yola Lane Corrective Rezoning","01/13/2021","","","Plan","7281 YOLA LN MANASSAS VA 20111","7895-94-9139","Yola Lane Corrective Rezoning - To rezone 10.5152-acre parcels from A-1, Agricultural to SR-5, Semi-Rural Residential, to allow for the existing single-family homes on the properties to remain. The sites are addressed as 7281 and 7278 Yola Lane; is located approximately 935 feet northwest from the intersection of Yola Lane and Marian Drive; and is designated SRR, Semi Rural Residential, and ER, Environmental Resource in the Comprehensive Plan. The properties are identified on County maps as GPINs 7895-94-9139 and 7995-04-3443. The subject site is located within Domestic Fowl Overlay District.  Occoquan Magisterial District."
"SDR2021-00040","Subdivision Plan - Asbuilt","Review Completed","","01/08/2021","","","Plan","2175 CHERRY HILL RD","8389-11-0801","POTOMAC SHORES LANDBAY 4 SEC 1 - FINAL SUBDIVISION PLAN FOR RESIDENTIAL"
"REZ2021-00010","Rezoning - Residential","Under Review","Old Carolina Overlook","01/08/2021","","","Plan","7370 OLD CAROLINA RD GAINESVILLE VA 20155","7297-55-9404","Old Carolina Overlook - To rezone 15.92 acres from A-1, Agricultural, to SR-1, Semi Rural Residential, to allow the development of up to 12 single-family residences.   The subject property is located approximately 230 feet south of the intersection of Old Carolina Road and Mercury Lane; and is identified on County maps as GPINs 7297-55-9404 and 7297-65-2922.  The site is designated SRR, Semi-Rural Residential in the Comprehensive Plan; and is located within the Route 29 Small Area Plan.  Brentsville Magisterial District"
"MOD2021-00006","Rezoning Minor Modification","Approved","","12/29/2020","","","Plan","17291 RIVER RIDGE BLVD DUMFRIES VA 22026","8389-16-6386","Potomac Shores MOD - Amend Proffers Associated with PLN2012-00420 and amended by PLN2014-00399 for a FAR decrease"
"REZ2021-00009","Rezoning - Residential","Approved","Lake Pointe Rezoning","12/21/2020","","","Plan","2580 CATON HILL RD WOODBRIDGE VA 22192","8292-75-8519","Lake Pointe Residential - To rezone 15.52 acres from B-1, General Business, to PMR, Planned Mixed Residential, with associated waivers and modifications, including a sign modification, to allow the development of up to 355 multi-family units.  The subject property is located northeast of Caton Hill Rd. and Killarney Dr., and approximately 380 feet northwest of the intersection of Caton Hill Rd. and Telegraph Rd.  The site is currently addressed as 2526 and 2580 Caton Hill Rd., and is identified on County maps as GPINs 8292-75-8519 and 8292-84-1372.00.  The site is zoned B-1, General Business, with proffers; and is currently designated TC, Town Center, and POSP, Parks and Open Space, in the Comprehensive Plan, and located within the Landing at Prince William Small Area Plan. Occoquan Magisterial District"
"REZ2021-00014","Rezoning - Non-Residential","Approved","Wellington Glen Parcel K","11/20/2020","","","Plan","8870 HORNBAKER RD MANASSAS VA 20109","7596-61-9286","Wellington Glen Parcel K - To rezone 40.4 acres from PMD, Planned Mixed District, to PBD, Planned Business District, with associated development waivers and modifications, to include use modifications to allow heavy industrial uses, among other changes.  The subject property, including right-of-way, is located on the west side of Hornbaker Road and south of its intersection with Wellington Road.  The subject site encompasses Lay Bay K, is currently addressed as 8870 Hornbaker Road, and is identified on County maps as GPIN 7596-61-9286.  The site is currently zoned PMD, Planned Mixed District; is designated REC, Regional Employment Center, in the Comprehensive Plan; and is located within the Data Center Opportunity Zone Overlay District and Airport Safety Overlay District.  Brentsville Magisterial District"
"REZ2021-00008","Rezoning - Mixed Use","Under Review","Windsor Oaks","11/17/2020","","","Plan","3695 ELM FARM RD WOODBRIDGE VA 22192","8192-95-1352","Windsor Oaks - To rezone 9.77 acres from O(M), Office Mid-Rise, to PMR, Planned Mixed Residential, to develop a mixed-use community, consisting of up to 160 multi-family residential units and 25,000 square feet of commercial/retail uses, and with associated waivers and modifications.  The subject property is located at the northeast intersection of Elm Farm Road and Prince William Parkway, is currently addressed as 3695 Elm Farm Road, and is identified on County maps as GPIN 8192-95-1352.  The site is currently zoned O(M), Office Mid-Rise; is designated NMU, Neighborhood Mixed-Use, and O, Office, in the Comprehensive Plan; and is located within the Parkway Node of the Dale City Small Area Plan.  The site is also located in the Prince William Parkway and Minnieville Road (Davis Ford Road) Highway Corridor Overlay Districts.  Occoquan Magisterial District"
"REZ2021-00007","Rezoning - Non-Residential","Approved","Wellington Commerce Park","10/29/2020","","","Plan","5780 WELLINGTON RD GAINESVILLE VA 20155","7497-21-1386","Wellington Commerce Center - To rezone 6.24 acres from A-1, Agricultural, to M-1, Heavy Industrial, for industrial uses.  The subject property is located 0.17 miles south of the Wellington Road and University Blvd. intersection, is currently addressed as 5780 Wellington Road, and is identified on County maps as GPIN 7497-21-1386.  The site is designated EI Industrial Employment, in the Comprehensive Plan; and is located within the Airport Safety Overlay District, and Data Center Opportunity Overlay District.  Brentsville Magisterial District"
"ZNR2021-00097","Zoning Review - Interpretation/Determination","Closed","","10/26/2020","","","Plan","4381 RIDGEWOOD CENTER DR WOODBRIDGE VA 22192","8193-30-7967","Interpretation/determination of proffers-85-09"
"CPA2021-00002","Comp Plan Amendment (Concurrent with Rezoning)","Pending","Bristow Plaza","09/28/2020","","","Plan","11920 NOKESVILLE RD BRISTOW VA 20136","7594-28-8497","Bristow Plaza - To amend the Comprehensive Plan long-range land use map designation of 7.72 acres from SRL, Suburban Residential Low, to GC, General Commercial (pending CPA initiation).  Concurrently, there is a request to rezone 7.72 acres from A-1, Agricultural, to B-1, General Business, to allow for a mixture of commercial, retail, and office uses in a development to be known as Bristow Plaza.  The subject property is located at the northwest quadrant of the intersection of Nokesville Road (Rt. 28), and Vint Hill Road, and is identified on County maps as GPINs 7594-28-8497 and 7594-38-1791.  The site is partially located within the Nokesville Road (Route 28) Highway Corridor Overlay District and is located within the Airport Safety Overlay District.  (Concurrently processed with #SUP2021-00010.)  Brentsville Magisterial District"
"REZ2021-00006","Rezoning - Non-Residential","Pending","Bristow Plaza","09/28/2020","","","Plan","11920 NOKESVILLE RD BRISTOW VA 20136","7594-28-8497","BRISTOW PLAZA - This is a request to rezone 7.72 acres from A-1, Agricultural, to PMR, Planned Mixed Residential, and with associated development waivers and modifications, to allow for a mixed use development to be known as Bristow Plaza.  The subject property is located at the northwest intersection of Nokesville Road (Rt. 28) and Vint Hill Road, and is identified on County maps as GPINs 7594-28-8497 and 7594-38-1791.  The site is designated MU-3, Neighborhood Mixed Use, and is located within the Bristow Activity Center in the Comprehensive Plan.  The project area is partially located within the Nokesville Road (Route 28) Highway Corridor Overlay District, and is located within the Airport Safety Overlay District and Agritourism and Arts Overlay District.  Brentsville Magisterial District"
"REZ2021-00005","Rezoning - Mixed Use","Approved","University Village at Innovation","09/18/2020","","","Plan","11100 UNIVERSITY BLVD MANASSAS VA 20110","7696-00-5505","University Village at Innovation - To rezone 24.19 acres from PBD, Planned Business District, and A-1, Agricultural, to PMD, Planned Mixed Use District, to allow a mixed-use development consisting of 1,630 multifamily units (including1,480 student housing units) and 1,625,000 sq. ft. of nonresidential uses (office, retail and hotel) and associated waivers and modifications, including building height and floor area ratio increases.  The application also includes a request to release the subject site from the Declaration for the property of the Prince William Board of County Supervisors at Innovation at Prince William County. The property is located on the north side of University Blvd, between Prince William Pkwy (Route 234 By-Pass) and Cannon Creek Ln; and is identified on County maps as GPINs 7696-00-5505, and 7596-92-6825(part). The site is designated TC, Town Center, in the Comprehensive Plan, and is located within the Innovation Park Small Area Plan.  The site is currently zoned A-1 and PBD; is also located within the Technology Overlay District (TeOD); and the Airport Safety Overlay District. Brentsville Magisterial District"
"REZ2021-00004","Rezoning - Non-Residential","Approved","Congressional Storage","08/10/2020","","","Plan","10615 DUMFRIES RD MANASSAS VA 20112","7794-78-2053","Congressional Storage - This is a request to rezone an approximately 0.345-acre portion of the subject property currently addressed 10615 Dumfries Road, and identified on County maps as GPIN 7794-78-2053(pt.), from A-1, Agricultural, to B-1, General Business.  This application is being concurrently processed with a special use permit (SUP2021-00007) request to allow a self-storage center and interim commercial parking use.  The SUP area includes 2.473-acres and is located at 10613 and 10615 Dumfries Road, and identified on County maps as GPINs 7794-78-1662 and 7794-78-2053.  The subject area is zoned B-1, General Business, and A-1, Agricultural; is designated CEC, Community Employment Center, in the Comprehensive Plan; is located within the Route 234 (Dumfries Road) Highway Corridor Overlay District, Airport Safety Overlay District, and is subject to proffers pursuant to REZ2011-000268.  Coles Magisterial District."
"MOD2021-00002","Rezoning Minor Modification","Approved","Ashley Business Park","08/04/2020","","","Plan","7404 CUSHING RD MANASSAS VA 20109","7597-03-1361","Ashley Business Park - Administrative Minor Modification to REZ2019-00039, Ashley Business Park, to allow construction of six (6) foot black PVC chain link fencing in lieu of the proffered ten (10) foot board on board fencing (proffer 3), and to enhance the existing vegetation with additional planting of evergreens at 7ft on center in the twenty foot buffer along Prince William Parkway (proffer 18a). The subject property is addressed 7404 Cushing Road, and is located at on the west side of Cushing Road, 1,475 feet from the intersection of Cushing Road and Balls Ford Road.  The site is identified on County maps as GPINs 7597-03-1361.  The site is designated EI, Industrial Employment, in the Comprehensive Plan; and is located within the Data Center Opportunity Zone Overlay"
"REZ2021-00003","Rezoning - Non-Residential","Deferred","John Marshall Commons Technology Park","07/31/2020","","","Plan","14392 JOHN MARSHALL HWY GAINESVILLE VA 20155","7397-46-4281","John Marshall Commons Tech Park - This is a request to rezone 22.72 acres from B-1, General Business, and M-2, Light Industrial to, O(M), Office Mid-Rise, for the purpose of developing a data center campus. There is a concurrent SUP request is to allow for a data center use, subject to the approval of the rezoning application.  The subject property is located to the south of Interstate 66, at the northwestern intersection of Catharpin Road and John Marshall Highway (Route 55); and is identified on County maps as GPINs 7397-36-8980, 7397-46-4050, 7397-46-4281, and 7397-47-7731.  The 22.72-acre site is currently zoned B-1, General Business, and M-2, Light Industrial; is designated CEC, Community Employment Center, in the Comprehensive Plan; is located within the I-66 / Route 29 Sector Plan special planning area, and located partially within the Airport Safety Overlay District.  Gainesville Magisterial District."
"SUP2021-00004","Special Use - Special Use Permit","Deferred","John Marshall Commons Technology Park","07/31/2020","","","Plan","14392 JOHN MARSHALL HWY GAINESVILLE VA 20155","7397-46-4281","John Marshall Commons Tech Park - This is a Special Use Permit request to allow for a data center use.  This application is being concurrently processed with a rezoning request, (#REZ2021-00003) to rezone 22.72 acres from B-1, General Business, and M-2, Light Industrial to, O(M), Office Mid-Rise, for the purpose of developing a data center campus.    The subject property is located to the south of Interstate 66, at the northwestern intersection of Catharpin Road and John Marshall Highway (Route 55); and is identified on County maps as GPINs 7397-36-8980, 7397-46-4050, 7397-46-4281, and 7397-47-7731.  The 22.72-acre site is currently zoned B-1, General Business, and M-2, Light Industrial; is designated CEC, Community Employment Center, in the Comprehensive Plan; is located within the I-66 / Route 29 Sector Plan special planning area, and located partially within the Airport Safety Overlay District.  Gainesville Magisterial District."
"REZ2021-00001","Rezoning - Proffer Amendment","Approved","I-66 & Route 29 Technology Park","07/20/2020","","","Plan","14300 JOHN MARSHALL HWY GAINESVILLE VA 20155","7397-65-0198","I-66 & Route 29 Technology Park - This is a request to rezone 5.01 acres from A-1, Agricultural, to B-1, General Business and amend the proffers associated with Rezoning #REZ1997-0004 to include the entire site and permit up to 2,957,680 square feet, in the event the subject site is developed with a data center use and associated modifications for signage, increased building height, and increased floor area ratio. The subject 103.32-acre site is located on the east side of John Marshall Hwy, at the southeastern corner of the intersection of Catharpin Road and John Marshall Hwy; is identified on County maps as GPINs 7397-65-0198, 7397-54-4690 and 7397-55-1465; is designated as RCC, Regional Commercial Center, in the Comprehensive Plan; and is located within the I-66/Route 29 Sector Plan. Concurrently processed with Special Use Permit #SUP2021-00002, I-66 and Route 29 Technology Park. Gainesville Magisterial District"
"SUP2021-00002","Special Use - Special Use Permit","Approved","I-66 & Route 29 Technology Park","07/20/2020","","","Plan","14210 JOHN MARSHALL HWY GAINESVILLE VA 20155","7397-65-0198","I-66 & Route 29 Technology Park - Special Use Permit to allow data center uses outside of the Data Center Opportunity Overlay District in the B-1 zoning district with associated waiver modifications for increased building height and FAR. The subject 102.38-acre site is located on the east side of John Marshall Hwy, at the southeastern corner of the intersection of Catharpin Road and John Marshall Hwy; is identified on County maps as GPINs 7397-65-0198 and 7397-55-1465; is designated as RCC, Regional Commercial Center, in the Comprehensive Plan; and is located within the I-66/Route 29 Sector Plan. Concurrently processed with Rezoning & Proffer Amendment #REZ2021-00001, I-66 and Route 29 Technology Park Gainesville Magisterial District"
