Case Number,Type,Status,Project Name,Applied Date,Expiration Date,Completion Date,Module Name,Address,Main Parcel,Description
"PLN2013-00011","Rezoning - Residential","Approved","","07/11/2012","","","Plan","4608 ASDEE LN","8193-25-8167","REZ - GLASS PROPERTY REZONING - TO REZONE 10.057 ACRES FROM AGRICULTURAL, A-1 TO RESIDENTIAL, R-4 - TO PERMIT THE DEVELOPMENT OF 20 SINGLE FAMILY DETACHED HOMES - THE PARCELS ARE LOCATED AT 4532, 4536, 4608 AND 4614 ASDEE LANE, ON THE NORTH SIDE OF ASDEE LANE, IMMEDIATELY NORTH OF THE INTERSECTION OF ASDEE LANE AND COVENTRY GLEN DRIVE"
"PLN2013-00009","Rezoning - Proffer Amendment","Approved","Rivergate Proffer Amendment","07/10/2012","","","Plan","13110 RIVERGATE PL","8492-18-2976","PRA - RIVERGATE PROFFER AMENDMENT - TO AMEND REZ #PLN2005-00565 FROM PLANNED MIXED RESIDENTIAL, PMR, (URBAN HIGH) TO PMR (URBAN) - TO REDUCE MAX HEIGHT ON MULTI-FAMILY DWELLING UNITS TO 5 STORIES - NO LONGER A GATED COMMUNITY - THE PROPERTY IS LOCATED AT THE NORTHEAST  CORNER OF ANNAPOLIS WAY AND MARINA DRIVE - COMPREHENSIVE PLAN LONG RANGE LAND USE DESIGNATION URBAN MIXED USE, UMU, AND LOCATED WITHIN THE NORTH WOODBRIDGE STUDY AREA OF THE POTOMAC COMMUNITIES SECTOR PLAN - "
"PLN2013-00005","Rezoning - Proffer Amendment","Approved","","07/03/2012","","","Plan","13900 CHURCH HILL DR","8392-51-6593","PRA - SAINT MARGARET'S CHURCH - TO AMEND PROFFERS OF REZ# PLN2006-00439 FOR THE ALLOWANCE OF A RELIGIOUS INSTITUTION AND MEDICAL OFFICE - 13900 CHURCH HILL DRIVE BETWEEN PRINCE WILLIAM PARKWAY AND JEFF DAVIS HWY, 1/8 MILE FROM INTERSECTION OF CHURCH HILL DRIVE AND PRINCE WILLIAM PARKWAY - ZONED PMR, PLANNED MIXED RESIDENTIAL - LRLU COMP PLAN DESIGNATION SRH, SUBURBAN RESIDENTIAL HIGH AND WITHIN THE POTOMAC COMMUNITIES SECTOR PLAN"
"PLN2012-00434","Special Use - Special Use Permit","Approved","","06/26/2012","","","Plan","1800 POTOMAC SHORES PY","8389-42-9772","SUP - POTOMAC SHORES TOWN CENTER - TO AMEND SUP# PLN2000-00079 - ACREAGE INCREASE FROM 130 ACRES TO 228 ACRES - TO PROVIDE UP TO 3.7 MILLION SQ.FT OF RETAIL, OFFICE, AND POTENTIAL HOTEL - 1,833 MIXED RESIDENTIAL USES INCLUDING (MULTI-FAMILY, TOWNHOUSE, DETACHED SINGLE-FAMILY HOUSES) - THERE IS A COMPANION REZONING/PROFFER AMENDMENT APPLICATION REZ# PLN2012-00420 - THE PROPERTY IS LOCATED ON CHERRY HILL PENINSULA, APPROX. 5,500 FEET EAST OF THE INTERSECTION OF RIVER HERITAGE BLVD. AND HARBOR STATION PKWY - LOCATED WITHIN THE POTOMAC COMMUNITIES SECTOR PLAN, COMPREHENSIVE PLAN DESIGNATION OF SRH, UMU, SRL, AND ER"
"PLN2012-00420","Rezoning - Mixed Use","Approved","","06/08/2012","","","Plan","17291 RIVER RIDGE BL","8389-16-6386","REZ - POTOMAC SHORES - TO REZONE 1885.46 ACRES FROM A-1, SR-1, PMR, PBD, PMD, AND M-1 TO PMR, PLANNED MIXED RESIDENTIAL, AND PMD, PLANNED MIXED DISTRICT - THIS REZONING ALSO AMENDS THE PROFFERS FROM PLN2000-00077, PLN2000-00078, PLN2010-00454, PLN2010-00455 - LOCATED ON THE CHERRY HILL PENINSULA, GENERALLY EAST OF THE INTERSECTION OF RIVER HERITAGE BOULEVARD AND HARBOR STATION PARKWAY - "
"PLN2012-00398","Comp Plan Amendment (Concurrent with Rezoning)","Withdrawn","","05/30/2012","","","Plan","1950 CHERRY HILL RD","8389-23-9026","CPA - POTOMAC SHORES - TO CHANGE THE LRLU DESIGNATION OF +/- 1885.5 AC FROM UMU, CRHS, SRL, SRM, SRH, SRR, CEC, REC AND ER TO UMU, CRHS, AND SRL"
"PLN2012-00389","Rezoning - Proffer Interpretation/Determination","Closed","","05/22/2012","","","Plan","10000 GODWIN DR","7695-62-0648","PRI - PROFFER INTERPRETATION FOR GLEN - GERY GODWIN DRIVE PROPERTY AND GLEN - GERY CAPITAL LAND DEVELOPMENT"
"PLN2012-00382","Rezoning - Proffer Interpretation/Determination","Closed","","05/15/2012","","","Plan","15524 FARM CREEK DR","8390-89-3734","PRI - Proffer interpretation for Rippon center"
"PLN2012-00379","Rezoning - Proffer Amendment","Withdrawn","","05/10/2012","","","Plan","11671 IRON BRIGADE UNIT AV","7594-59-1346","PROFFER AMENDMENT NEW BRISTOW VILLAGE"
"PLN2012-00369","Rezoning - Non-Residential","Approved","","05/09/2012","","","Plan","7640 CHESTNUT ST","7897-32-1663","Rezoning - GPIN 7897-32-1354 and 7897-32-1663 from R-4 to B-1."
"PLN2012-00371","Rezoning - Non-Residential","Dismissed","MANASSAS FAMILY DENTAL CARE CENTER","05/04/2012","","","Plan","10416 BALLS FORD RD","7697-56-5456","REZ MANASSAS FAMILY DENTAL CARE CENTER; A-1 TO O(M); FEC & REC"
"PLN2012-00360","Rezoning - Proffer Interpretation/Determination","Closed","","04/24/2012","","","Plan","5227 HOADLY RD","8093-60-4594","Proffer Determination for Hoadly Forest for maintenance of off-site trail"
"PLN2012-00339","Rezoning - Proffer Amendment","Approved","","04/04/2012","","","Plan","12085 SUDLEY MANOR DR","7596-30-6083","PRA WITH REZ PEMBROOKE; B-1 TO PMR & AMEND PRA #PLN2006-00091; B-1; SRM"
"PLN2012-00331","Rezoning - Proffer Amendment","Approved","","03/15/2012","","","Plan","8126 QUARRY RD","7896-31-8680","AMEND THE PROFFERED CONDITIONS OF REZ #PLN2005-00374 TO ALLOW FOR CHANGES IN THE MULTIFAMILY HOUSING TYPE, LAYOUT AND TOTAL NUMBER OF UNITS."
"PLN2012-00327","Rezoning - Proffer Interpretation/Determination","Closed","","03/14/2012","","","Plan","2498 CATON HILL RD","8292-84-5534","PRI - PROFFER INTERPRETATION FOR CATON HILL PROPERTIES IN ASSOCIATION WITH REZ#95-0014"
"PLN2012-00317","Rezoning - Proffer Interpretation/Determination","Closed","","03/05/2012","","","Plan","16400 NAVIGATION DR","8290-73-1033.00","ZND - ZONING DETERMINATION/ INTERPRETATION FOR DEVELOPER OF LAND CODOMINIUM TO USE THE COMMON EASEMENT AREA FOR DEVELOPMENT REZ#95-008"
"PLN2012-00309","Rezoning - Proffer Interpretation/Determination","Closed","","02/29/2012","","","Plan","6518 OLD CAROLINA RD","7298-92-6903","PRI - PROFFER INTERPRETATION FOR REZONING CASE 94-0030 BLUE MARKET"
"PLN2012-00306","Rezoning - Residential","Approved","","02/23/2012","","","Plan","5750 WEBSTERS WY","8093-20-9730","REZ - REZONE 14.7394 ACRES FROM A-1 TO R-4 - 39 LOT SINGLE FAMILY DETACHED HOME RESIDENTIAL DEVELOPMENT - LOCATED ON THE NORTHERN SIDE OF WEBSTERS WAY, APPROXIMATELY 1200 FEET SOUTHWEST OF ITS INTERSECTION WITH HOADLY ROAD AND JESSICA RIDGE WAY - WITHIN THE HOADLY ROAD HIGHWAY CORRIDOR OVERLAY DISTRICT, HCOD - ZONED AGRICULTURAL, A-1 - COMPREHENSIVE PLAN LONG RANGE LAND USE DESIGNATION OF SUBURBAN RESIDENTIAL LOW, SRL - "
"PLN2012-00301","Comp Plan Amendment (Concurrent with Rezoning)","Approved","","02/21/2012","","","Plan","16271 LEE HY","7196-77-8115","CPA - MAP AND TEXT AMENDMENT TO THE CULTURAL RESOURCES CHAPTER TO CONSIDER THE ADDITION OF 5 PROPERTIES TO THE LIST OF COUNTY REGISTERED HISTORIC SITES (CRHS)"
"PLN2012-00248","Rezoning - Proffer Interpretation/Determination","Closed","","02/17/2012","","","Plan","15425 EWELLS MILL WY","8090-59-9350","PRI- PROFFER INTERPRETATION FOR EWLLS MILL ESTATES-PLN2005-00119"
"LBE2005-00346","Bonds/Escrows Siltation/Erosion Control Escrow","Active","","02/06/2012","","","Plan","16210 JEFFERSON DAVIS HY","8290-63-3926","SILTATION & EROSION ESCROW- **NEW DEVELOPER***POSTED $100,000.00 IN ACCORDANCE WITH REZONING PLN2000-00077 CONDITION #6 AND $100,000.00 IN ACCORDANCE WITH REZONING PLN2000-00078 CONDITION # 6.  **ESCROW MUST BE PROVIDED AS CASH ESCROW DUE TO PROFFER (NOT LOC) (MCF)"
"PLN2012-00271","Rezoning - Proffer Interpretation/Determination","Closed","","01/30/2012","","","Plan","2300 VANTAGE DR","8391-00-0525","PRI - PROFFER INTERPRETATION OF RIPPON LANDING"
"PLN2012-00256","Rezoning - Proffer Amendment","Approved","","01/24/2012","","","Plan","2263 YORK DR","8392-23-3489","PRA - KENSINGTON PLACE - TO AMEND THE PROFFERS OF REZONING #PLN2005-00232 TO MODIFY THE RECREATION AMENITY PACKAGE AND INCORPORATE CHANGES TO THE BUILDING FOOTPRINT AND ARCHITECTURE. TO REMOVE PLANNED SWIMMING POOL AND PROVIDE AMENITY DECK WITH PUTTING GREEN, SUN DECK AREA, GRILL ISLAND, OUTDOOR DINING AREA AND SEATING AREAS - ZONED R-30 - LOCATED ON THE NORTH AND SOUTH SIDES OF YORK DRIVE, 1300 FT. SOUTHWEST OF THE INTERSECTION OF YORK DRIVE AND PRINCE WILLIAM PRKY - LONG RANGE LAND USE PLAN DESIGNATED URBAN RESIDENTIAL HIGH, URH, AND WITHIN THE POTOMAC COMMUNITIES REVITALIZATION PLAN"
"PLN2012-00238","Rezoning - Residential","Closed","","01/17/2012","","","Plan","2264 YORK DR","8392-13-7053","REZ#PLN2005-00232-PLANNING DIRECTOR MODIFICATION FOR KENSINGTON PLACE"
"PLN2012-00228","Comp Plan Amendment (Concurrent with Rezoning)","Approved","","01/09/2012","","","Plan","10713 DUMFRIES RD","7794-77-5445","CPA - CHANGE THE LONG RANGE LAND USE DESIGNATION OF +/- 22.1 ACRES FROM CEC, COMMUNITY EMPLOYMENT CENTER, TO SRM, SUBURBAN RESIDENTIAL MEDIUM. "
"PLN2012-00227","Comp Plan Amendment (Concurrent with Rezoning)","Withdrawn","","01/09/2012","","","Plan","10920 BALLS FORD RD","7597-92-1061","CPA - CHANGE THE LONG RANGE LAND USE DESIGNATION OF +/- 99 ACRES FROM REC, REGIONAL EMPLOYMENT CENTER, AND SRH, SUBURBAN RESIDENTIAL HIGH TO  SRM, SUBURBAN RESIDENTIAL MEDIUM AND SRH, SUBURBAN RESIDENTIAL HIGH."
"PLN2012-00229","Comp Plan Amendment (Concurrent with Rezoning)","Approved","","01/06/2012","","","Plan","5570 CATHARPIN RD","7398-96-4050","CPA - CHANGE THE LONG RANGE LAND USE DESIGNATION OF +/-127 ACRES FROM  SRR, SEMI-RURAL RESIDENTIAL AND ER,  ENVIRONMENTAL RESOURCE TO SRL, SUBURBAN RESIDENTIAL LOW & ER,  ENVIRONMENTAL RESOURCE."
"PLN2012-00226","Comp Plan Amendment (Concurrent with Rezoning)","Approved","","01/06/2012","","","Plan","10611 DUMFRIES RD","7794-78-7434","CPA - CHANGE THE LONG RANGE LAND USE DESIGNATION OF +/- 40.28 ACRES FROM CEC, COMMUNITY EMPLOYMENT CENTER, and SRL, SUBURBAN RESIDENTIAL LOW TO  SRM, SUBURBAN RESIDENTIAL MEDIUM."
"PLN2012-00225","Comp Plan Amendment (Concurrent with Rezoning)","Closed","Preserve at Long Branch (Mid-County Park & Estates)","01/06/2012","","","Plan","12775 CLASSIC SPRINGS DR","7792-99-5798","Mid-County Park & Estate Homes CPA - To amend the Comprehensive Plan land use designation for +/- 325.6 acres from SRR, Semi-Rural Residential, ER, Environmental Resource, and AE, Agricultural or Estate, to SRR, Semi-Rural Residential and P&OS, Parks and Open Space. The property is located in the Coles Magisterial District and identified on the County maps as GPINS 7792-99-5798, 7893-11-6930, and 7893-10-7686, and is zoned A-1, Agricultural, and SR-1, Semi-Rural Residential. The site falls within both the Rural Area and Development Area of the County and is located within the Domestic Fowl Overlay District."
"PLN2012-00224","Comp Plan Amendment (Concurrent with Rezoning)","Closed","","01/03/2012","","","Plan","8223 LINTON HALL RD","7496-17-4609","STONE HAVEN - CHANGE THE LONG RANGE LAND USE DESIGNATION OF +/- 337 ACRES FROM FEC, FLEXIBLE EMPLOYMENT CENTER TO SRM, SUBURBAN RESIDENTIAL MEDIUM, SRL, SUBURBAN RESIDENTIAL LOW AND GC, GENERAL COMMERCIAL."
"PLN2012-00202","Rezoning - Non-Residential","Approved","","12/13/2011","","","Plan","14904 JEFFERSON DAVIS HY","8391-24-6189","REZ - WOODBRIDGE MEDICAL OFFICE PROPERTY - TO REZONE 0.3994 SECTION OF PROPERTY FROM A-1 TO O(L) - TO ALLOW FOR ADDITIONAL PARKING - THE PROPERTY IS LOCATED ON THE WEST SIDE OF ROUTE 1, AT THE NORTHWEST CORNER OF ROUTE 1 AND DELAWARE DRIVE - PROPERTY IS SPLIT ZONED, PART OF THE PROPERTY IS AGRICULTURAL (A-1) ANOTHER PART OF THE PROPERTY IS OFFICE LOW-RISE (OL) - LONG RANGE LAND USE DESIGNATION OF OFFICE (O)"
"PLN2012-00195","Rezoning - Proffer Interpretation/Determination","Closed","","12/06/2011","","","Plan","10129 LINTON HALL RD","7595-42-4428","PRI-PROFFER INTERPRETATION FOR YOUTH FOR TOMORROW/STADLER PROPERTY"
"PLN2012-00190","Rezoning - Proffer Interpretation/Determination","Closed","","12/02/2011","","","Plan","15131 LILYWOOD LN","7298-74-8054","PRI-PROFFER INTERPRETATION FOR MARKET CENTER SECTION 3-REQUEST A CONFIRMATION THAT THE PROPOSED HOUSING TYPE YARDS AND SETBACKS ARE IN COMPLIANCE"
"PLN2012-00189","Rezoning - Proffer Interpretation/Determination","Closed","","12/02/2011","","","Plan","15142 SILICA ST","7298-74-8054","PROFFER INTERPRETATION FOR MARKET CENTER SECTION 3-REQUEST A CONFIRMATION THAT THE PROPSED HOUSING TYPE YARDS AND SETBACKS ARE IN COMPLIANCE*******CASE OPENED IN ERROR-DUPLICATE CASE*****"
"ZPA2012-02524","Zoning Approval - Sign","Voided","","12/02/2011","","","Plan","7929 HERITAGE VILLAGE PZ","7397-87-6611","**THE APPLICANT FAILED TO RECEIVED APPROVAL FROM THE HERITAGE HUNT ARCHITECTURAL REVIEW BOARD.** SIGN-NEW FREESTANDING DIRECTIONAL PLUS DIRECTIONAL ARROW FOR HERITAGE HUNT PAZA. SHALL COMPLY WITH ALL APPICABLE SIGN REGULATIONS AND PROFFER #13 OF REZONING #PLN2003-0046."
"ZPA2012-02522","Zoning Approval - Sign","Voided","","12/02/2011","","","Plan","7929 HERITAGE VILLAGE PZ","7397-87-6611","**THE APPLICANT FAILED TO RECEIVED APPROVAL FROM THE HERITAGE HUNT ARCHITECTURAL REVIEW BOARD.** SIGN-NEW FREESTANDING DIRECTIONAL SIGN WITH ARROW FOR HERITAGE HUNT PLAZA. SHALL COMPLY WITH ALL APPLICABLE SIGN REGULATIONS AND PROFFER #13 OF REZONING #PLN2003-0046"
"ZPA2012-02521","Zoning Approval - Sign","Voided","","12/02/2011","","","Plan","7929 HERITAGE VILLAGE PZ","7397-87-6611","**THE APPLICANT FAILED TO RECEIVED APPROVAL FROM THE HERITAGE HUNT ARCHITECTURAL REVIEW BOARD.** SIGN-NEW FREESTANDING SHOPPING CENTER SIGN FOR HERITAGE HUNT PLAZA-INTERCHANGEABLE SIGN. SHALL COMPLY WITH ALL APPLICABLE SIGN REGULATIONS AND PROFFER 13 OF REZONING #PLN2003-00046."
"PLN2012-00174","Rezoning - Proffer Amendment","Approved","","11/17/2011","","","Plan","5100 WELLINGTON RD Unit: NONE (BJS REVISED)","7397-71-5114","PRA VA. GATEWAY (PROMENADE ADDITION); AMEND PROFFER #16(B) of  REZ #PLN2001-00113, VA. GATEWAY/USDATAPORT; THE AMENDED PROFFERS WILL ALSO INCLUDE PROHIBITED USES FOR LANDBAY B FROM REZ #2004-00385"
"PLN2012-00169","Rezoning - Proffer Amendment","Approved","","11/14/2011","","","Plan","7800 CARRICK DR","7397-81-4732","PRA WENTWORTH GREEN AT VA. GATEWAY PROMENADE EXCLUSION (TO REMOVE REFERENCE TO AREA #1 OR LANDBAY B AS REFERENCED IN REZ #2011-00113); B-1, M-2 & PMR; RCC & SRM; PORTIONS ON THE NORTH SIDE OF WELLINGTON RD ARE WITHIN THE ROUTE 29 HCOD"
"PLN2012-00151","Rezoning - Proffer Interpretation/Determination","Closed","","10/28/2011","","","Plan","9604 HORNBAKER RD","7595-76-8519","PRI-PROFFER INTERPRETATION FOR UNIVERSITY BLVD EXTENSION (HORNBAKER ROAD) PPTA PROJECT-PLN2005-00600"
"PLN2012-00149","Rezoning - Proffer Interpretation/Determination","Withdrawn","","10/27/2011","","","Plan","10604 BRISTOW RD","7594-27-8799","PRI-PROFFER INTERPRETATION REGARDING ARCHITECHTURAL REVIEW BOARD (APPLICANT REQUESTED WITHDRAWAL OF REQUEST & REFUND)"
"PLN2012-00148","Rezoning - Proffer Interpretation/Determination","Closed","","10/26/2011","","","Plan","2264 YORK DR","8392-13-7055","PRD-PROFFER DETERMINATION FOR KENSINGTON PLACE"
"PLN2012-00153","Rezoning - Non-Residential","Approved","","10/25/2011","","","Plan","8492 WELLINGTON RD","7696-13-5211","VIRGINIA CRANE RENTAL, INC. (2.76 AC FROM A-1 TO M-1); REC"
"PLN2012-00137","Rezoning - Proffer Interpretation/Determination","Closed","","10/18/2011","","","Plan","9100 AUTUMN GLORY LN","7496-60-2428","PROFFER INTERPRETATION FOR PLN2004-00389"
"PLN2012-00122","Rezoning - Proffer Interpretation/Determination","Closed","","10/11/2011","","","Plan","15142 SILICA ST","7298-74-8054","PROFFER INTERPRETATION FOR MARKET CENTER SECTION 3-REQUEST A CONFIRMATION THAT THE PROPSED HOUSING TYPE YARDS AND SETBACKS ARE IN COMPLIANCE"
"PLN2012-00120","Rezoning - Proffer Amendment","Approved","","10/04/2011","","","Plan","15242 TURTLE POINT DR","7297-60-9339","REZ LAKE MANASSAS RPC-PARCEL B-2-B (REZONE 11.9 AC FROM RPC COMMERCIAL TO RPC RESIDENTIAL; RPC"
"PLN2012-00105","Rezoning - Proffer Amendment","Approved","","09/20/2011","","","Plan","7728 WELLINGTON RD","7596-62-8129","PRA - WELLINGTON GLEN - TO AMEND PROFFERS WITHIN PLN# PRA2010-00138 WITH RESPECT TO THE DEVELOPMENT'S COMMUNITY RECREATION CENTER - PROPERTY IS LOCATED ON THE SOUTHWEST SIDE OF WELLINGTON ROAD (ROUTE 674) AT THE NORTHWEST QUADRANT OF THE INTERSECTION OF WELLINGTON ROAD AND SUDLEY MANOR DRIVE."
"PLN2012-00089","Rezoning - Proffer Interpretation/Determination","Closed","","08/29/2011","","","Plan","7805 LINTON HALL RD","7397-71-6634","PROFFER DETERIMINATION FOR VIRGINIA GATEWAY PHASE V-THE PROMENADE"
"PLN2012-00075","Rezoning - Proffer Interpretation/Determination","Closed","","08/17/2011","","","Plan","4520 ASDEE LN","8193-24-8339","PROFFER INTERPRETATION REGARDING REZ# PLN2006-00898, GREATBRIDGE ROAD SIDEWALK-PWC PKWY PROJECT-MAY'S QUARTER"
"PLN2012-00039","Rezoning - Proffer Interpretation/Determination","Closed","","07/26/2011","","","Plan","7320 SUDLEY RD","7697-24-8731","CURRENT PROPERTY WANTS TO CREATE NEW PROPERTY AS A JIFFY LUBE WITH DRIVE THRU SERVICING"
"PLN2012-00033","Rezoning - Proffer Interpretation/Determination","Closed","","07/25/2011","","","Plan","15200 HEATHCOTE BL","7298-73-4282","PROFFER DET FOR MARKT CTR-PORTION OF LAND BAY 1"
"PLN2012-00027","Rezoning - Proffer Interpretation/Determination","Closed","","07/19/2011","","","Plan","9040 CLAYTON RD","7596-61-1272","PRI / UNIVERSITY VILLAGE, "
"PLN2012-00021","Rezoning - Residential","Approved","","07/15/2011","","","Plan","14627 BRISTOW RD","7891-67-3407","REZ - WOLF RUN RESIDENTIAL - TO REZONE 4.68 ACRES FROM A-1 TO R-4 - TO CREATE 11 SINGLE-FAMILY DETACHED RESIDENTIAL PARCELS - LOCATED 0.23 MILES TO THE NORTHWEST OF THE INTERSECTION OF ADEN ROAD AND BRISTOW ROAD - ZONED A-1, AGRICULTURAL - COMPREHENSIVE PLAN DESIGNATION FEC, FLEXIBLE USE EMPLOYMENT CENTER - "
"PLN2012-00012","Rezoning - Proffer Interpretation/Determination","Closed","","07/14/2011","","","Plan","7503 CENTREVILLE RD","7897-33-2356","DETERMINATION THAT UNITS ARE IN CONFORMANCE WITH MZP"
"PLN2012-00007","Rezoning - Non-Residential","Approved","","07/12/2011","","","Plan","6513 OLD CAROLINA RD","7398-01-0778","REZ HEATHCOTE DEVELOPMENT (2.87 AC FROM A-1 TO O(M); CEC; PARTIALLY LOCATED WITHIN ASOD (AIRPORT SAFETY OVERLAY DISTRICT)"
"PLN2012-00006","Rezoning - Proffer Amendment","Withdrawn","","07/08/2011","","","Plan","2301 RIVER HERITAGE BL","8389-41-3404","PRA - HARBOR STATION SOUTH ADDITION - TO AMEND THE PROFFERED CONDITIONS OF REZ# PLN2010-00454, HARBOR STATION SOUTH ADDITION - TO DELETE THE SPECIFIC REFERENCED PROVISIONS OF THE BALD EAGLE MANAGEMENT PRACTICES AND TO COMMIT THAT ALL STATE AND FEDERAL REGULATIONS GOVERNING PROTECTION OF THE BALD EAGLE APPLICABLE AT THE TIME OF DEVELOPMENT OF ANY PORTION OF THE PROPERTY WHERE EAGLES ARE IMPACTED WILL BE FOLLOWED - HARBOR STATION SOUTH ADDITION - PROFFER  # 42 - THE PROPERTY IS 742 ACRES AND LOCATED GENERALLY SOUTH OF CHERRY HILL ROAD APPROXIMATELY 1.2 MILES EAST OF ITS INTERSECTION WITH NEW CHERRY HILL ROAD AND EXTENDING SOUTH TO POSSUM POINT ROAD AND THE VIRGINIA POWER PROPERTY AND EAST TO THE CSX RAILROAD - ZONED PLANNED MIXED RESIDENTIAL, PMR - ZONED PLANNED MIXED DISTRICT, PMD - PLANNED MIXED USE DISTRICT, PMD - DESIGNATED SRL, SUBURBAN RESIDENTIAL LOW, SRM, SUBURBAN RESIDENTIAL MEDIUM, SRH SUBURBAN RESIDENTIAL HIGH, AND ER, "
"PLN2012-00005","Rezoning - Proffer Amendment","Withdrawn","","07/08/2011","","","Plan","1501 CHERRY HILL RD","8389-41-3404","PRA - HARBOR STATION SOUTH AMENDMENT - TO AMEND THE PROFFERED CONDITIONS OF REZ# PLN2010-00455, HARBOR STATION SOUTH - TO DELETE THE SPECIFIC REFERENCED PROVISIONS OF THE BALD EAGLE MANAGEMENT PRACTICES AND TO COMMIT THAT ALL STATE AND FEDERAL REGULATIONS GOVERNING PROTECTION OF THE BALD EAGLE APPLICABLE AT THE TIME OF DEVELOPMENT OF ANY PORTION OF THE PROPERTY WHERE EAGLES ARE IMPACTED WILL BE FOLLOWED - HARBOR STATION SOUTH AMENDMENT - PROFFER  #24.G - THE PROPERTY IS 742 ACRES AND LOCATED GENERALLY SOUTH OF CHERRY HILL ROAD APPROXIMATELY 1.2 MILES EAST OF ITS INTERSECTION WITH NEW CHERRY HILL ROAD AND EXTENDING SOUTH TO POSSUM POINT ROAD AND THE VIRGINIA POWER PROPERTY AND EAST TO THE CSX RAILROAD - ZONED PLANNED MIXED RESIDENTIAL, PMR - ZONED PLANNED MIXED DISTRICT, PMD - DESIGNATED SRL, SUBURBAN RESIDENTIAL LOW, SRM, SUBURBAN RESIDENTIAL MEDIUM, SRH SUBURBAN RESIDENTIAL HIGH, AND ER, ENVIRONMENTAL RESOURCE"
"PLN2012-00004","Rezoning - Proffer Amendment","Withdrawn","","07/08/2011","","","Plan","17378 CABANA CT Unit: UPW001","8389-17-2358","PRA - HARBOR STATION NORTH - TO AMEND THE PROFFERED CONDITIONS OF REZ# PLN2000-00077, HARBOR STATION NORTH - TO DELETE THE SPECIFIC REFERENCED PROVISIONS OF THE BALD EAGLE MANAGEMENT PRACTICES AND TO COMMIT THAT ALL STATE AND FEDERAL REGULATIONS GOVERNING PROTECTION OF THE BALD EAGLE APPLICABLE AT THE TIME OF DEVELOPMENT OF ANY PORTION OF THE PROPERTY WHERE EAGLES ARE IMPACTED WILL BE FOLLOWED - SOUTHBRIDGE - PROFFER # 3. A. 7 - THE PROPERTY IS 731.7 ACRES AND LOCATED AT THE INTERSECTION OF RIVER HERITAGE BLVD AND HARBOR STATION PARKWAY AND EXTENDING IN A NOTHEASTERLY AND EASTERLY DIRECTION TO POWELLS CREEK AND THE CSX RAILROAD - ZONED PLANNED MIXED RESIDENTIAL, PMR - ZONED PLANNED MIXED DISTRICT, PMD - DESIGNATED SRL, SUBURBAN RESIDENTIAL LOW, SRM, SUBURBAN RESIDENTIAL MEDIUM, SRH SUBURBAN RESIDENTIAL HIGH, AND ER, ENVIRONMENTAL RESOURCE"
"PLN2012-00003","Rezoning - Proffer Amendment","Withdrawn","","07/08/2011","","","Plan","17378 CABANA CT Unit: UPW001","8389-17-2358","PRA - HARBOR STATION NORTH - TO AMEND TO THE PROFFERED CONDITIONS OF REZ# PLN2000-00078, HARBOR STATION NORTH (PHASE II-A) - A REQUEST TO DELETE THE SPECIFIC REFERENCED PROVISIONS OF THE BALD EAGLE MANAGEMENT PRACTICES AND TO COMMIT THAT ALL STATE AND FEDERAL REGULATIONS GOVERNING PROTECTION OF THE BALD EAGLE APPLICABLE AT THE TIME OF DEVELOPMENT OF ANY PORTION OF THE PROPERTY WHERE EAGLES ARE IMPACTED WILL BE FOLLOWED - SOUTHBRIDGE - PROFFER # 3. A. 7 - THE PROPERTY IS 222.2 ACRES AND LOCATED IN THE NORTHEAST QUADRANT AT THE INTERSECTION OF RIVER HERITAGE BLVD. AND HARBOR STATION PARKWAY - ZONED PLANNED MIXED RESIDENTIAL, PMR - DESIGNATED SRL, SUBURBAN RESIDENTIAL LOW, SRM, SUBURBAN RESIDENTIAL MEDIUM, SRH SUBURBAN RESIDENTIAL HIGH, AND ER, ENVIRONMENTAL RESOURCE"
"PLN2012-00023","Rezoning - Residential","Approved","","06/27/2011","","","Plan","4017 BRADYS HILL RD","8188-66-8115","REZ - REZONE 3.21 ACRES FROM R-16, SUBURBAN RESIDENTIAL TO V, VILLAGE FOR MIXED USE DEVELOPMENT. CONCURRENT WITH CPA #PLN2011-00350, URM TO VMU AND SUP #PLN2012-00025 FOR MODIFICATIONS TO DEVELOPMENT STANDARDS DESCRIBED IN SEC. 32-351.08"
"PLN2011-00437","Rezoning - Proffer Amendment","Approved","","06/07/2011","","","Plan","10101 HARRY J PARRISH BL","7694-86-5813","PRA - AIRPORT GATEWAY COMMERCE CENTER I - TO AMEND THE PROFFER CONDITIONS OF REZ# PLN2002-00024 TO ALLOW A DATA CENTER AS A BY-RIGHT USE ON THE PORTION OF THE PROPERTY ZONED M/T - LOCATED ON THE WEST SIDE OF ROUTE 234 BYPASS AT ITS INTERSECTION WITH CLOVERHILL ROAD - "
"PLN2011-00440","Rezoning - Proffer Amendment","Approved","","06/03/2011","","","Plan","3400 BRIARWOOD DR","8289-05-7697","PRA BRIARWOOD OVERLOOK (AMEND REZ #PLN2004-00383 TO INCREASE NUMBER OF ALLOWABLE UNITS FROM 48 TO 73 & TO ALTER UNIT CONFIGURATION BY BUILDING TWO MULTI-FAMILY BUILDINGS); R-16; SRH & ER"
"PLN2011-00429","Special Use - Special Use Permit","Approved","","05/27/2011","","","Plan","10865 COVERSTONE DR","7697-23-1646","SUP - ORCHARD GLEN - TO ALLOW A SELF STORAGE FACILITY - THERE IS A COMPANION REZONING HAS BEEN SUBMITTED THAT REQUESTS THE PROPERTY'S ZONING CHANGE FROM O(L), OFFICE LOW-RISE TO O(F), OFFICE HIGH-RISE - THE PROPERTY IS LOCATED ON THE SOUTH SIDE OF COVERSTONE DRIVE, APPROXIMATELY 280 FEET WEST OF SAGE STREET - THE LONG-RANGE LAND USE PLAN DESIGNATION FOR THIS PROPERTY IS SUBURBAN RESIDENTIAL HIGH, SRH.
"
"PLN2011-00411","Rezoning - Proffer Amendment","Withdrawn","","05/17/2011","","","Plan","401 BELMONT BAY DR","8492-53-7716","PRA - BELMONT TOWN CENTER - TO AMEND THE PROFFERED CONDITIONS OF REZONING #99-0022 TO DELETE THE AGE RESTRICTIONS ON 600 UNITS AND ALLOW RESIDENTIAL UNITS IN LAND BAY/BLOCK M WITHOUT INCREASING THE OVERALL CAP ON THE RESIDENTIAL UNITS - "
"PLN2011-00397","Rezoning - Proffer Interpretation/Determination","Closed","","05/02/2011","","","Plan","12001 VINT HILL RD","7594-19-8955","PI/INTERPRETATION FOR REALIGNMENT OF VINT HILL RD. OBLIGATIONS"
"PLN2011-00395","Rezoning - Proffer Interpretation/Determination","Closed","","05/02/2011","","","Plan","12001 VINT HILL RD","7594-19-8955","REZONING DETERMINATION TO ALLOW MINOR MODIFICATIONS TO MASTER ZONING PLAN OF REZ#PLN2006-00781."
"PLN2011-00404","Rezoning - Non-Residential","Approved","","04/25/2011","","","Plan","9450 HAWKINS DR","7595-57-8482","REZONE +/- 5.416 ACRES FROM M-2, LIGHT INDUSTRIAL TO M/T, INDUSTRIAL/TRANSPORTATION; EI"
"PLN2011-00373","Rezoning - Residential","Approved","","04/05/2011","","","Plan","3996 FORTUNA CENTER PZ Unit: PARCEL ADDRESS","8190-72-1677","REZONE 15.27 ACRES FROM B-1, GENERAL BUSINESS TO R-16, SUBURBAN RESIDENTIAL. CONCURRENT WITH CPA #PLN2011-00214 (SRM TO SRH)"
"PLN2011-00359","Rezoning - Residential","Approved","","03/31/2011","","","Plan","16305 THOROUGHFARE RD","7297-19-1584","REZ - VILLAGES OF PIEDMONT II - TO REZONE 493.49 ACRES FROM A-1, AGRICULTURAL, B-1, GENERAL BUSINESS, O(M) OFFICE MID RISE, O(F) OFFICE/FLEX, M-2, LIGHT INDUSTRIAL, AND R-2, SUBURBAN RESIDENTIAL, TO A-1, AGRICULTURAL, R-4, SUBURBAN RESIDENTIAL, AND R-6, SUBURBAN RESIDENTIAL, TO BE CONSIDERED CONCURRENTLY WITH THE COMPREHENSIVE PLAN AMENDMENT REQUEST CPA#PLN2011-00188 - LOCATED AT THE INTERSECTION OF ROUTE 15 AND MARKET RIDGE BOULEVARD "
"PLN2011-00350","Comp Plan Amendment (Concurrent with Rezoning)","Approved","","03/25/2011","","","Plan","18428 OLD TRIANGLE RD","8188-75-3363","CPA - CHANGE THE LRLU DESIGNATION OF +/- 3.21 ACRES FROM URM, URBAN RESIDENTIAL MEDIUM TO VMU, VILLAGE MIXED-USE. CONCURRENT WITH REZ #PLN2012-00023, R-16 TO V AND SUP #PLN2012-00025, MODIFICATIONS OF STANDARDS."
"PLN2011-00325","Rezoning - Non-Residential","Approved","","03/08/2011","","","Plan","12801 RANDOLPH RIDGE LN","7497-64-3717","REZ RANDOLPH RIDGE LLC (9.39 AC FROM M-2 TO M-T); EI; WITHIN HCOD & AIRPORT SAFETY OVERLAY DISTRICT"
